{
  "eventId": "exec-event-1",
  "requestId": "invoke-req-1",
  "executionId": "exec-example-1",
  "sequence": 1,
  "timestamp": "2026-03-31T17:00:00Z",
  "eventType": "accepted",
  "status": "pending",
  "correlationId": "corr-example-1",
  "traceRef": "trace-example-1",
  "capabilityId": "cap.example.echo",
  "message": "Invocation accepted for execution.",
  "progress": null,
  "failure": null,
  "metadata": {
    "surface": "elegy-cli"
  }
}
